<?xml version="1.0" encoding="UTF-8"?>
<?xml-stylesheet type="text/xsl" href="../../../template/objectWrapper.xsl"?>
<object name="encodeURIComponent" xmlns="http://www.jsman.net/xsd/manual"
	xmlns:xsi="http://www.w3.org/2001/XMLSchema-instance" xsi:schemaLocation="http://www.jsman.net/xsd/manual ../../../schema/jsman-manual.xsd">
	<lead>
		<p>encodeURIComponent</p>
	</lead>
	<description>
		<p>encodeURIComponent(<params/>)</p>
	</description>
	<parameters>
		<parameter name="uriComponent" type="string" optional="false"/>
	</parameters>
	<examples>
		<example>
			<heading>encodeURIComponent example</heading>
			<p>Encodes a url parameter.</p>
			<code>
				var uriComponent = encodeURIComponent('{"foo": ["bar"]}');
				console.log(uriComponent);  // %7B%22foo%22:%20%5B%22bar%22%5D%7D
			</code>
			<p>If used on a url, it will encode it as a parameter.</p>
			<code>
				var uriComponent = encodeURIComponent('http://example.com/');
				console.log(uriComponent);  // http%3A%2F%2Fexample.com%2F
			</code>
		</example>
	</examples>
	<see-also>
		<ul>
			<li><p><xref href="manual/1. Standard Global Objects/encodeURI/encodeURI.xml">encodeURI object</xref></p></li>
		</ul>
	</see-also>
	<external>
		<mdn href="https://developer.mozilla.org/docs/Web/JavaScript/Reference/Global_Objects/encodeURIComponent">encodeURIComponent object</mdn>
	</external>
</object>
