<?xml version="1.0" encoding="UTF-8"?>
<?xml-stylesheet type="text/xsl" href="../../../../template/methodWrapper.xsl"?>
<method name="startsWith" parent="String" xmlns="http://www.jsman.net/xsd/manual"
	xmlns:xsi="http://www.w3.org/2001/XMLSchema-instance" xsi:schemaLocation="http://www.jsman.net/xsd/manual ../../../../schema/jsman-manual.xsd">
	<lead>
		<p>startsWith â€” Check if the string ends with this string.</p>
	</lead>
	<description>
		<p>String.startsWith(<params/>)</p>
	</description>
	<parameters>
		<parameter name="string" type="string" optional="false"></parameter>
	</parameters>
	<return>
		<p>boolean primitive.</p>
	</return>
	<changelog>
		<change version="ES 6">Introduced.</change>
	</changelog>
	<examples>
		<example>
			<heading>startsWith example</heading>
			<code>
				console.log('Hello World'.startsWith('World'));   // false
				console.log('Hello World'.startsWith('Hello'));   // true
			</code>
		</example>
	</examples>
	<external>
		<mdn href="https://developer.mozilla.org/docs/Web/JavaScript/Reference/Global_Objects/String/startsWith">String.startsWith method</mdn>
	</external>

</method>
