<?xml version="1.0" encoding="UTF-8"?>
<?xml-stylesheet type="text/xsl" href="../../../../template/methodWrapper.xsl"?>
<method name="toGMTString" parent="Date" xmlns="http://www.jsman.net/xsd/manual"
	xmlns:xsi="http://www.w3.org/2001/XMLSchema-instance" xsi:schemaLocation="http://www.jsman.net/xsd/manual ../../../../schema/jsman-manual.xsd">
	<lead>
		<p>toGMTString – Deprecated.</p>
	</lead>
	<description>
		<p>Date.toGMTString()</p>
	</description>
	<changelog>
		<change version="ES 1">Deprecated.</change>
	</changelog>
	<see-also>
		<ul>
			<li><p><xref href="manual/1. Standard Global Objects/Date/7. toUTCString/toUTCString.xml">Date.toUTCString()</xref></p></li>
		</ul>
	</see-also>
	<external>
		<mdn href="https://developer.mozilla.org/docs/Web/JavaScript/Reference/Global_Objects/Date/toGMTString">Date.toGMTString method</mdn>
	</external>

</method>
