<?xml version="1.0" encoding="UTF-8"?>
<?xml-stylesheet type="text/xsl" href="../../../../template/methodWrapper.xsl"?>
<method name="values" parent="Array" xmlns="http://www.jsman.net/xsd/manual"
	xmlns:xsi="http://www.w3.org/2001/XMLSchema-instance" xsi:schemaLocation="http://www.jsman.net/xsd/manual ../../../../schema/jsman-manual.xsd">
	<lead>
		<p>values â€” Returns an <xref href="">ArrayIterator</xref> with the values of the array.</p>
	</lead>
	<description>
		<p>Array.values(<params/>)</p>
	</description>
	<changelog>
		<change version="ES 6">Introduced.</change>
	</changelog>
	<examples>
		<example>
			<heading>values example</heading>
			<code>
				var array = [2, 4, 8];
				var keys = array.values();

				console.log(typeof values);  // object
				console.log(values);         // ArrayIterator {}
			</code>
		</example>
	</examples>
	<external>
		<mdn href="https://developer.mozilla.org/docs/Web/JavaScript/Reference/Global_Objects/Array/values">Array.values method</mdn>
	</external>

</method>
