<?xml version="1.0" encoding="UTF-8"?>
<?xml-stylesheet type="text/xsl" href="../../../../template/methodWrapper.xsl"?>
<method name="sort" parent="Array" xmlns="http://www.jsman.net/xsd/manual"
	xmlns:xsi="http://www.w3.org/2001/XMLSchema-instance" xsi:schemaLocation="http://www.jsman.net/xsd/manual ../../../../schema/jsman-manual.xsd">
	<lead>
		<p>sort â€” Sorts an array.</p>
	</lead>
	<description>
		<p>Array.sort(<params/>)</p>
	</description>
	<parameters>
		<parameter name="compare" type="function" optional="true"></parameter>
	</parameters>
	<return>
		<p>The sorted array.</p>
	</return>
	<examples>
		<example>
			<heading>sort example</heading>
			<code>
				var array = [32, 8, 2, 16, 4];
				console.log(array);          // [32, 8, 2, 16, 4]
				console.log(array.sort());   // [16, 2, 32, 4, 8]
				console.log(array);          // [16, 2, 32, 4, 8]
			</code>
		</example>
		<example>
			<heading>sort example</heading>
			<code>
				var array = [32, 8, 2, 16, 4];

				var compare = function (a, b) {
					if (a &lt; b) {
						return -1;
					}
					else if (a &gt; b) {
						return 1;
					}
					return 0;
				};

				console.log(array);                 // [32, 8, 2, 16, 4]
				console.log(array.sort(compare));   // [2, 4, 8, 16, 32]
				console.log(array);                 // [2, 4, 8, 16, 32]
			</code>
			<p>A shorter inline version.</p>
			<code>
				var array = [32, 8, 2, 16, 4];

				console.log(array);                 // [32, 8, 2, 16, 4]
				console.log(array.sort(function (a, b) {
					return a - b;
				}));                                // [2, 4, 8, 16, 32]
				console.log(array);                 // [2, 4, 8, 16, 32]
			</code>
		</example>
	</examples>
	<external>
		<mdn href="https://developer.mozilla.org/docs/Web/JavaScript/Reference/Global_Objects/Array/sort">Array.sort method</mdn>
	</external>

</method>
